Symbol,Name,Last Sale,Net Change,% Change,Market Cap,Country,IPO Year,Volume,Sector,Industry
CL,Colgate-Palmolive Company Common Stock,$73.55,0.72,0.989%,61430005146.00,United States,,3524320,Consumer Discretionary,Package Goods/Cosmetics
CLBK,Columbia Financial Inc. Common Stock,$20.35,0.00,0.00%,2217549187.00,United States,2018,253247,Finance,Commercial Banks
CLDX,Celldex Therapeutics Inc.,$43.57,0.25,0.577%,2052139637.00,United States,,203093,Health Care,Biotechnology: In Vitro & In Vivo Diagnostic Substances
CLF,Cleveland-Cliffs Inc. Common Stock,$19.94,0.06,0.302%,10275131511.00,United States,,7738698,,
CLH,Clean Harbors Inc. Common Stock,$134.14,1.16,0.872%,7253526065.00,United States,,199400,,
CLVT,Clarivate Plc Ordinary Shares,$10.96,0.04,0.366%,7389109204.00,,2019,9154696,Technology,EDP Services
CLX,Clorox Company (The) Common Stock,$150.51,0.42,0.28%,18591736913.00,United States,,1205188,Consumer Discretionary,Specialty Chemicals
CM,Canadian Imperial Bank of Commerce Common Stock,$46.21,0.50,1.094%,41873183644.00,Canada,,506576,,
CMA,Comerica Incorporated Common Stock,$75.08,-0.73,-0.963%,9832991999.00,United States,,1504356,Finance,Major Banks
CMC,Commercial Metals Company Common Stock,$55.76,0.77,1.40%,6530759912.00,United States,,1160101,Industrials,Steel/Iron Ore
CMCSA,Comcast Corporation Class A Common Stock,$38.36,0.46,1.214%,161727920742.00,United States,,16100094,Consumer Discretionary,Telecommunications Equipment
CME,CME Group Inc. Class A Common Stock,$184.10,1.18,0.645%,66225946340.00,United States,2002,1714795,Finance,Investment Bankers/Brokers/Service
CMG,Chipotle Mexican Grill Inc. Common Stock,$1583.89,-23.02,-1.433%,43758129030.00,United States,2006,365267,Consumer Discretionary,Restaurants
CMI,Cummins Inc. Common Stock,$246.92,0.76,0.309%,34889796000.00,United States,,837073,Industrials,Construction/Ag Equipment/Trucks
CMS,CMS Energy Corporation Common Stock,$61.41,0.91,1.504%,17824350879.00,United States,,1484389,Utilities,Power Generation
CMTG,Claros Mortgage Trust Inc. Common Stock,$16.16,0.34,2.149%,2236158487.00,,2021,192095,Real Estate,Real Estate Investment Trusts
CNA,CNA Financial Corporation Common Stock,$44.24,0.04,0.09%,11984696915.00,United States,,226938,Finance,Property-Casualty Insurers
CNC,Centene Corporation Common Stock,$72.74,1.18,1.649%,40061845960.00,United States,,4949329,Health Care,Medical Specialities
CNHI,CNH Industrial N.V. Common Shares,$16.22,0.22,1.375%,21803588550.00,,2013,6528938,Industrials,Construction/Ag Equipment/Trucks
CNI,Canadian National Railway Company Common Stock,$119.85,3.14,2.69%,80589819127.00,Canada,,1301843,,
CNM,Core & Main Inc. Class A Common Stock,$22.16,0.06,0.271%,3820369175.00,,2021,447273,Industrials,Industrial Machinery/Components
CNMD,CONMED Corporation Common Stock,$97.91,-2.62,-2.606%,2984532959.00,United States,1987,377408,Health Care,Biotechnology: Electromedical & Electrotherapeutic Apparatus
CNO,CNO Financial Group Inc. Common Stock,$25.87,0.35,1.371%,2958055221.00,United States,,784599,Finance,Life Insurance
CNP,CenterPoint Energy Inc (Holding Co) Common Stock,$29.31,0.66,2.304%,18451689345.00,United States,,2614799,Utilities,Electric Utilities: Central
CNQ,Canadian Natural Resources Limited Common Stock,$60.61,1.69,2.868%,67097148910.00,Canada,,1617504,,
CNS,Cohen & Steers Inc Common Stock,$73.94,0.29,0.394%,3601346780.00,United States,2004,75755,Finance,Investment Managers
CNX,CNX Resources Corporation Common Stock,$16.37,0.24,1.488%,2784971263.00,United States,1999,2149577,Energy,Oil & Gas Production
CNXC,Concentrix Corporation Common Stock,$146.17,-0.75,-0.51%,7611014748.00,United States,,151486,Technology,Computer Software: Prepackaged Software
COF,Capital One Financial Corporation Common Stock,$115.39,-0.21,-0.182%,43998207000.00,United States,1994,1666612,Finance,Finance Companies
COHR,Coherent Corp. Common Stock,$42.38,-0.48,-1.12%,5877683217.00,United States,,1124219,Industrials,Industrial Machinery/Components
COIN,Coinbase Global Inc. Class A Common Stock,$57.09,-2.54,-4.26%,14951871000.00,United States,,17343643,Technology,EDP Services
COKE,Coca-Cola Consolidated Inc. Common Stock,$502.78,-2.72,-0.538%,4712903355.00,United States,1972,22127,Consumer Staples,Beverages (Production/Distribution)
COLB,Columbia Banking System Inc. Common Stock,$31.86,-0.02,-0.063%,2505665319.00,United States,1992,564390,Finance,Major Banks
COLD,Americold Realty Trust Inc. Common Stock,$30.76,0.30,0.985%,8286722068.00,United States,2018,513868,Real Estate,Real Estate Investment Trusts
COLM,Columbia Sportswear Company Common Stock,$89.59,-0.42,-0.467%,5564759753.00,United States,1998,355940,Consumer Discretionary,Apparel
COO,The Cooper Companies Inc. Common Stock,$335.14,-0.48,-0.143%,16564408448.00,United States,,279737,Health Care,Ophthalmic Goods
COOP,Mr. Cooper Group Inc. Common Stock,$46.54,1.92,4.303%,3284082441.00,United States,,1197078,Finance,Finance: Consumer Services
COP,ConocoPhillips Common Stock,$115.06,5.13,4.667%,140816871360.00,United States,,10772648,Energy,Integrated oil Companies
CORT,Corcept Therapeutics Incorporated Common Stock,$23.00,-0.04,-0.174%,2475946642.00,United States,2004,568820,Health Care,Biotechnology: Pharmaceutical Preparations
COST,Costco Wholesale Corporation Common Stock,$499.99,-0.64,-0.128%,221860080710.00,United States,,1536466,Consumer Discretionary,Department/Specialty Retail Stores
COTY,Coty Inc. Class A Common Stock,$10.41,0.08,0.774%,8849671125.00,United States,2013,6336481,Consumer Discretionary,Package Goods/Cosmetics
COUP,Coupa Software Incorporated Common Stock,$80.11,0.01,0.012%,6051613543.00,United States,2016,1339711,Technology,Computer Software: Prepackaged Software
CP,Canadian Pacific Railway Limited Common Stock,$79.67,2.09,2.694%,74132935000.00,Canada,,1598463,,
CPA,Copa Holdings S.A. Copa Holdings S.A. Class A Common Stock,$91.61,0.21,0.23%,3610884095.00,Panama,2005,373704,Consumer Discretionary,Air Freight/Delivery Services
CPB,Campbell Soup Company Common Stock,$51.43,0.92,1.821%,15401616817.00,United States,,1768920,Consumer Staples,Packaged Foods
CPE,Callon Petroleum Company Common Stock,$41.82,2.25,5.686%,2576468348.00,United States,,1523400,Energy,Oil & Gas Production
CPG,Crescent Point Energy Corporation Ordinary Shares (Canada),$7.41,0.29,4.073%,4098641741.00,Canada,,6488724,,
CPK,Chesapeake Utilities Corporation Common Stock,$123.35,3.33,2.775%,2188356544.00,United States,,67657,Utilities,Oil & Gas Production
CPNG,Coupang Inc. Class A Common Stock,$15.65,-0.14,-0.887%,27705167268.00,,2021,4761614,Consumer Discretionary,Durable Goods
CPRI,Capri Holdings Limited Ordinary Shares,$49.85,0.41,0.829%,6251101117.00,Hong Kong,2011,4360829,,
CPRT,Copart Inc. (DE) Common Stock,$67.90,-1.32,-1.907%,32340770747.00,United States,1994,1145985,Consumer Discretionary,Other Specialty Stores
CPT,Camden Property Trust Common Stock,$122.82,0.73,0.598%,13330391520.00,United States,1993,581585,Real Estate,Real Estate Investment Trusts
CQP,Cheniere Energy Partners LP Cheniere Energy Partners LP Common Units,$54.20,1.94,3.712%,26234513967.00,United States,2007,242394,Utilities,Oil/Gas Transmission
CR,Crane Holdings Co. Common Stock,$118.96,0.71,0.60%,6678941036.00,United States,,340348,Industrials,Office Equipment/Supplies/Services
CRBG,Corebridge Financial Inc. Common Stock,$21.36,-0.05,-0.234%,13777200000.00,,2022,1103243,Finance,Finance Companies
CRC,California Resources Corporation Common Stock,$42.49,2.09,5.173%,3121779901.00,,2020,812240,Energy,Oil & Gas Production
CRCT,Cricut Inc. Class A Common Stock,$9.51,-0.34,-3.452%,2099983602.00,United States,2021,39950,Industrials,Wholesale Distributors
CRDO,Credo Technology Group Holding Ltd Ordinary Shares,$18.625,0.235,1.278%,2733436420.00,United States,2022,1150573,Technology,Semiconductors
CRH,CRH PLC American Depositary Shares,$46.27,-0.56,-1.196%,34437960945.00,Ireland,,712005,Industrials,Building Materials
CRI,Carter's Inc. Common Stock,$77.40,-0.28,-0.36%,2953707066.00,United States,2003,528825,Consumer Discretionary,Department/Specialty Retail Stores
CRK,Comstock Resources Inc. Common Stock,$12.38,0.55,4.649%,2893920054.00,United States,,4143140,Energy,Oil & Gas Production
CRL,Charles River Laboratories International Inc. Common Stock,$245.44,-4.38,-1.753%,12487657329.00,United States,2000,553605,Consumer Discretionary,EDP Services
CRM,Salesforce Inc. Common Stock,$167.03,-6.63,-3.818%,167030000000.00,United States,2004,11272827,Technology,Computer Software: Prepackaged Software
CROX,Crocs Inc. Common Stock,$115.30,0.52,0.453%,7119190890.00,United States,2006,1592765,Consumer Discretionary,Shoe Manufacturing
CRS,Carpenter Technology Corporation Common Stock,$49.34,0.06,0.122%,2393444372.00,United States,,223332,Industrials,Steel/Iron Ore
CRSP,CRISPR Therapeutics AG Common Shares,$49.78,-1.30,-2.545%,3897482239.00,Switzerland,2016,1231269,Health Care,Biotechnology: Biological Products (No Diagnostic Substances)
CRTO,Criteo S.A. American Depositary Shares,$34.61,-1.91,-5.23%,2083895684.00,France,2013,489313,Consumer Discretionary,Advertising
CRUS,Cirrus Logic Inc. Common Stock,$104.50,-0.48,-0.457%,5774373743.00,United States,1989,648621,Technology,Semiconductors
CRVL,CorVel Corp. Common Stock,$179.86,-1.09,-0.602%,3086215042.00,United States,,78959,Finance,Specialty Insurers
CRWD,CrowdStrike Holdings Inc. Class A Common Stock,$108.96,-4.46,-3.932%,25539548448.00,United States,2019,3456513,Technology,EDP Services
CS,Credit Suisse Group American Depositary Shares,$3.14,0.12,3.974%,12439300802.00,Switzerland,,27654545,Finance,Investment Bankers/Brokers/Service
CSAN,Cosan S.A. ADS,$12.01,0.21,1.78%,5604580895.00,,2021,155230,Consumer Discretionary,Retail-Auto Dealers and Gas Stations
CSCO,Cisco Systems Inc. Common Stock (DE),$47.26,0.53,1.134%,194148950757.00,United States,1990,17396491,Telecommunications,Computer Communications Equipment
CSGP,CoStar Group Inc. Common Stock,$75.96,0.17,0.224%,30892176958.00,United States,1998,1539447,Finance,Real Estate
CSIQ,Canadian Solar Inc. Common Shares (ON),$40.32,0.22,0.549%,2591318863.00,Canada,2006,900361,,
CSL,Carlisle Companies Incorporated Common Stock,$255.64,1.96,0.773%,13220669293.00,United States,,328249,,
CSQ,Calamos Strategic Total Return Common Stock,$14.58,0.0825,0.569%,2316581529.00,United States,2004,265997,Finance,Finance Companies
CSTM,Constellium SE Ordinary Shares (France),$13.99,-0.21,-1.479%,2018779272.00,Netherlands,2013,844592,Industrials,Aluminum
CSWI,CSW Industrials Inc. Common Stock,$139.56,1.09,0.787%,2159680533.00,United States,,64040,Industrials,Home Furnishings
CSX,CSX Corporation Common Stock,$31.57,0.44,1.413%,66373043575.00,United States,,10760901,Industrials,Railroads
CTAS,Cintas Corporation Common Stock,$442.86,4.77,1.089%,45003645330.00,United States,1983,321145,Consumer Discretionary,Business Services
CTLT,Catalent Inc. Common Stock,$70.46,-1.54,-2.139%,12689175432.00,United States,2014,2880667,Health Care,Biotechnology: Pharmaceutical Preparations
CTRA,Coterra Energy Inc. Common Stock,$25.07,0.71,2.915%,19766876490.00,United States,,9161416,Energy,Oil & Gas Production
CTSH,Cognizant Technology Solutions Corporation Class A Common Stock,$66.72,0.09,0.135%,33960480000.00,United States,1998,3282069,Technology,EDP Services
CTVA,Corteva Inc. Common Stock ,$64.47,1.87,2.987%,45994122930.00,,2019,4934424,Industrials,Major Chemicals
CUBE,CubeSmart Common Shares,$45.67,-0.26,-0.566%,10256325910.00,United States,,2453490,Real Estate,Real Estate Investment Trusts
CUK,Carnival Plc ADS ADS,$10.08,-0.34,-3.263%,13099221848.00,United States,,1964017,,
CUZ,Cousins Properties Incorporated Common Stock,$26.43,0.65,2.521%,4002408047.00,United States,,1504893,Real Estate,Real Estate Investment Trusts
CVBF,CVB Financial Corporation Common Stock,$24.49,-0.01,-0.041%,3424160036.00,United States,,467699,Finance,Major Banks
CVCO,Cavco Industries Inc. Common Stock When Issued,$284.40,-6.07,-2.09%,2472487996.00,United States,,63854,Consumer Discretionary,Homebuilding
CVE,Cenovus Energy Inc Common Stock,$20.07,0.74,3.828%,38512062090.00,Canada,,5398311,,
CVI,CVR Energy Inc. Common Stock,$34.36,2.07,6.411%,3454231382.00,United States,2007,776004,Energy,Integrated oil Companies
CVLT,Commvault Systems Inc. Common Stock,$63.97,-0.25,-0.389%,2850074921.00,United States,2006,240452,Technology,Computer Software: Prepackaged Software
CVS,CVS Health Corporation Common Stock,$89.66,-0.41,-0.455%,115133452063.00,United States,,7716353,Health Care,Managed Health Care
CVT,Cvent Holding Corp. Common Stock,$7.28,-0.10,-1.355%,3552067064.00,United States,1987,257316,Technology,Computer Software: Prepackaged Software
CVX,Chevron Corporation Common Stock,$171.97,3.53,2.096%,332527820756.00,United States,,11598958,Energy,Integrated oil Companies
CW,Curtiss-Wright Corporation Common Stock,$170.97,2.63,1.562%,6549463024.00,United States,,125208,,
CWAN,Clearwater Analytics Holdings Inc. Class A Common Stock,$19.15,-0.25,-1.289%,3625286730.00,,2021,277336,Technology,Computer Software: Prepackaged Software
CWEN,Clearway Energy Inc. Class C Common Stock,$32.54,0.41,1.276%,3800815111.00,United States,2015,556092,Utilities,Electric Utilities: Central
CWK,Cushman & Wakefield plc Ordinary Shares,$14.45,0.15,1.049%,3262183679.00,,2018,2287595,Finance,Real Estate
CWST,Casella Waste Systems Inc. Class A Common Stock,$80.42,1.26,1.592%,4156125946.00,United States,1997,281467,Utilities,Environmental Services
CWT,California Water Service Group Common Stock,$60.05,0.60,1.009%,3292181200.00,United States,,125108,Utilities,Water Supply
CX,Cemex S.A.B. de C.V. Sponsored ADR,$5.20,-0.06,-1.141%,7533649224.00,Mexico,,6053932,Industrials,Building Materials
CXM,Sprinklr Inc. Class A Common Stock,$10.75,0.00,0.00%,2806106019.00,,2021,1358636,Technology,Computer Software: Prepackaged Software
CYBR,CyberArk Software Ltd. Ordinary Shares,$145.10,-0.20,-0.138%,5907939338.00,Israel,2014,526827,Technology,Computer Software: Prepackaged Software
CYTK,Cytokinetics Incorporated Common Stock,$43.58,-0.72,-1.625%,4124019024.00,United States,2004,1005181,Health Care,Biotechnology: Pharmaceutical Preparations
CZR,Caesars Entertainment Inc. Common Stock,$52.17,-1.45,-2.704%,11193913698.00,United States,,3781843,Consumer Discretionary,Hotels/Resorts
D,Dominion Energy Inc. Common Stock,$59.54,1.81,3.135%,49613205706.00,United States,,5022795,Utilities,Electric Utilities: Central
DADA,Dada Nexus Limited American Depositary Shares,$12.10,-0.50,-3.968%,3092628171.00,China,2020,1333343,Consumer Discretionary,Department/Specialty Retail Stores
DAL,Delta Air Lines Inc. Common Stock,$38.17,-0.84,-2.153%,24474159778.00,United States,,8184636,Consumer Discretionary,Air Freight/Delivery Services
DAN,Dana Incorporated Common Stock ,$18.03,-0.53,-2.856%,2584662974.00,United States,,906873,Consumer Discretionary,Auto Parts:O.E.M.
DAR,Darling Ingredients Inc. Common Stock,$65.67,1.11,1.719%,10525024020.00,United States,1997,1316422,Consumer Staples,Farming/Seeds/Milling
DASH,DoorDash Inc. Class A Common Stock,$57.72,-4.13,-6.677%,22407905731.00,,2020,5369777,Industrials,Industrial Machinery/Components
DAVA,Endava plc American Depositary Shares (each representing one Class A Ordinary Share),$90.63,-1.33,-1.446%,5157796349.00,United Kingdom,2018,141946,Technology,EDP Services
DB,Deutsche Bank AG Common Stock,$12.11,-0.38,-3.042%,24680180000.00,Germany,,4344236,Finance,Commercial Banks
DBRG,DigitalBridge Group Inc.,$13.93,-0.21,-1.485%,2227341668.00,United States,2014,972472,Real Estate,Building operators
DBX,Dropbox Inc. Class A Common Stock,$23.58,-0.11,-0.464%,8553323793.00,United States,2018,2058237,Technology,Computer Software: Prepackaged Software
DCI,Donaldson Company Inc. Common Stock,$63.14,0.53,0.847%,7683312129.00,United States,,267342,Industrials,Pollution Control Equipment
DCP,DCP Midstream  LP Common Units ,$41.66,0.01,0.024%,8681800606.00,United States,,1124146,Utilities,Natural Gas Distribution
DCT,Duck Creek Technologies Inc. Common Stock,$18.81,0.01,0.053%,2499627211.00,United States,2020,791084,Technology,Retail: Computer Software & Peripheral Equipment
DD,DuPont de Nemours Inc. Common Stock,$75.81,0.05,0.066%,34730400302.00,,2017,1980866,Consumer Discretionary,Wholesale Distributors
DDOG,Datadog Inc. Class A Common Stock,$80.52,-2.88,-3.453%,25569918156.00,United States,2019,4321209,Technology,EDP Services
DDS,Dillard's Inc. Common Stock,$391.09,-2.88,-0.731%,6697382616.00,United States,,84103,Consumer Discretionary,Department/Specialty Retail Stores
DE,Deere & Company Common Stock,$417.79,9.78,2.397%,124149245591.00,United States,,1356398,Industrials,Industrial Machinery/Components
DECK,Deckers Outdoor Corporation Common Stock,$414.53,-6.27,-1.49%,10926703219.00,United States,1993,525872,Consumer Discretionary,Shoe Manufacturing
DEI,Douglas Emmett Inc. Common Stock,$16.15,0.07,0.435%,2838990816.00,United States,2006,1743069,Real Estate,Real Estate Investment Trusts
DELL,Dell Technologies Inc. Class C Common Stock ,$42.72,0.68,1.618%,30593000805.00,,2018,3963656,Technology,Computer Manufacturing
DEN,Denbury Inc. Common Stock,$86.98,3.08,3.671%,4331613829.00,,2020,330953,Energy,Oil & Gas Production
DEO,Diageo plc Common Stock,$171.14,-1.24,-0.719%,96723835062.00,United Kingdom,,391291,Consumer Staples,Beverages (Production/Distribution)
DFS,Discover Financial Services Common Stock,$115.00,0.47,0.41%,30705000000.00,United States,,2012782,Finance,Finance: Consumer Services
DG,Dollar General Corporation Common Stock,$229.59,0.59,0.258%,51330538102.00,United States,2009,1170596,Consumer Discretionary,Department/Specialty Retail Stores
DGX,Quest Diagnostics Incorporated Common Stock,$144.80,-1.22,-0.836%,16072800000.00,United States,,922287,Health Care,Medical Specialities
DHI,D.R. Horton Inc. Common Stock,$98.59,0.88,0.901%,33855150278.00,United States,,2387197,,
DHR,Danaher Corporation Common Stock,$258.84,3.73,1.462%,188513172000.00,United States,,2805163,Health Care,Medical Specialities
DINO,HF Sinclair Corporation Common Stock,$55.43,3.10,5.924%,11126493610.00,United States,1960,2072418,Energy,Integrated oil Companies
DIOD,Diodes Incorporated Common Stock,$93.92,-0.48,-0.508%,4270515445.00,United States,,209070,Technology,Semiconductors
DIS,Walt Disney Company (The) Common Stock,$108.06,-2.30,-2.084%,197402432593.00,United States,,15554800,Consumer Discretionary,Movies/Entertainment
DISH,DISH Network Corporation Class A Common Stock,$13.67,0.21,1.56%,7254757459.00,United States,1995,3001707,Consumer Discretionary,Telecommunications Equipment
DKL,Delek Logistics Partners L.P. Common Units representing Limited Partner Interests,$47.08,0.30,0.641%,2047611787.00,United States,2012,39366,Energy,Oil & Gas Production
DKNG,DraftKings Inc. Class A Common Stock,$15.99,-0.54,-3.267%,7177083278.00,United States,2019,14633317,Consumer Discretionary,Services-Misc. Amusement & Recreation
DKS,Dick's Sporting Goods Inc Common Stock,$129.28,-0.51,-0.393%,10783438203.00,United States,2002,844281,Consumer Discretionary,Other Specialty Stores
DLB,Dolby Laboratories Common Stock,$83.71,-0.23,-0.274%,8021249240.00,United States,2005,249817,Technology,EDP Services
DLO,DLocal Limited Class A Common Shares,$16.19,-0.18,-1.10%,4791998623.00,Uruguay,2021,782580,Consumer Discretionary,Business Services
DLR,Digital Realty Trust Inc. Common Stock,$111.46,0.16,0.144%,32047232772.00,United States,2004,1554017,Real Estate,Real Estate Investment Trusts
DLTR,Dollar Tree Inc. Common Stock,$147.04,-2.02,-1.355%,32522965792.00,United States,1995,1444391,Consumer Discretionary,Department/Specialty Retail Stores
DNA,Ginkgo Bioworks Holdings Inc. Class A Common Stock,$1.73,-0.02,-1.143%,3552450553.00,United States,2021,21310558,Health Care,Biotechnology: Biological Products (No Diagnostic Substances)
DNB,Dun & Bradstreet Holdings Inc. Common Stock,$13.96,-0.05,-0.357%,6082810051.00,United States,2020,1341148,Technology,Internet and Information Services
DNLI,Denali Therapeutics Inc. Common Stock,$29.13,-0.90,-2.997%,3956252149.00,United States,2017,643708,Health Care,Biotechnology: Biological Products (No Diagnostic Substances)
DNP,DNP Select Income Fund Inc. Common Stock,$11.45,0.13,1.148%,4063088227.00,United States,1987,457188,Finance,Investment Managers
DNUT,Krispy Kreme Inc. Common Stock,$12.22,-0.02,-0.163%,2046081643.00,United States,2021,396291,Consumer Discretionary,Specialty Foods
DOC,Physicians Realty Trust Common Shares of Beneficial Interest,$15.54,0.23,1.502%,3547173764.00,United States,2013,1860042,Real Estate,Real Estate Investment Trusts
DOCN,DigitalOcean Holdings Inc. Common Stock,$27.63,-1.43,-4.921%,2660688818.00,United States,2021,1049806,Technology,Retail: Computer Software & Peripheral Equipment
DOCS,Doximity Inc. Class A Common Stock,$31.72,-4.69,-12.881%,6105726560.00,,2021,8084988,Technology,Retail: Computer Software & Peripheral Equipment
DOCU,DocuSign Inc. Common Stock,$60.69,-3.16,-4.949%,12203190042.00,United States,2018,3165438,Technology,EDP Services
DOOO,BRP Inc. (Recreational Products) Common Subordinate Voting Shares,$87.24,-0.94,-1.066%,6869754541.00,Canada,,26422,,
DOOR,Masonite International Corporation Ordinary Shares (Canada),$90.11,-0.47,-0.519%,2007294055.00,Canada,,155230,,
DORM,Dorman Products Inc. Common Stock,$93.96,-0.46,-0.487%,2952089307.00,United States,,100214,Consumer Discretionary,Auto Parts:O.E.M.
DOV,Dover Corporation Common Stock,$153.25,0.10,0.065%,21509242838.00,United States,,554701,Industrials,Industrial Machinery/Components
DOW,Dow Inc. Common Stock ,$59.82,0.74,1.253%,42165916814.00,,2019,3826289,Industrials,Industrial Specialties
DOX,Amdocs Limited Ordinary Shares,$95.95,0.55,0.577%,11592352962.00,Guernsey,,663565,Technology,EDP Services
DPZ,Domino's Pizza Inc Common Stock,$354.06,-0.91,-0.256%,12533504129.00,United States,2004,699465,Consumer Discretionary,Food Distributors
DQ,DAQO New Energy Corp. American Depositary Shares each representing five ordinary shares,$42.12,-0.24,-0.567%,3158146817.00,China,2010,806144,Technology,Semiconductors
DRI,Darden Restaurants Inc. Common Stock,$147.02,-0.74,-0.501%,17893112618.00,United States,,1153365,Consumer Discretionary,Restaurants
DRS,Leonardo DRS Inc. Common Stock,$13.51,0.16,1.199%,3515129883.00,Israel,,827751,Industrials,Military/Government/Technical
DRVN,Driven Brands Holdings Inc. Common Stock,$28.56,0.08,0.281%,4781059582.00,United States,2021,492913,,
DSGX,Descartes Systems Group Inc. (The) Common Stock,$74.04,-0.79,-1.056%,6279924276.00,Canada,,80441,,
DT,Dynatrace Inc. Common Stock,$43.35,-0.76,-1.723%,12530398218.00,United States,2019,3723141,Technology,EDP Services
DTE,DTE Energy Company Common Stock,$113.68,1.68,1.50%,22024589537.00,United States,,888873,Utilities,Electric Utilities: Central
DTM,DT Midstream Inc. Common Stock ,$54.31,0.69,1.287%,5254545887.00,,2021,887539,Utilities,Oil & Gas Production
DUK,Duke Energy Corporation (Holding Company) Common Stock,$99.11,1.56,1.599%,76320921333.00,United States,,2633166,Utilities,Power Generation
DUOL,Duolingo Inc. Class A Common Stock,$91.61,-3.40,-3.579%,3679949607.00,United States,2021,468649,Technology,Computer Software: Prepackaged Software
DV,DoubleVerify Holdings Inc. Common Stock,$27.45,0.11,0.402%,4525821138.00,,2021,851262,Technology,Computer Software: Prepackaged Software
DVA,DaVita Inc. Common Stock,$83.08,0.37,0.447%,7485508000.00,United States,,639767,Health Care,Medical/Nursing Services
DVN,Devon Energy Corporation Common Stock,$63.54,3.24,5.373%,41536098000.00,United States,1985,8692113,Energy,Oil & Gas Production
DXC,DXC Technology Company Common Stock ,$28.90,-0.25,-0.858%,6580023730.00,,,1096149,Technology,EDP Services
DXCM,DexCom Inc. Common Stock,$117.89,10.65,9.931%,45535970356.00,United States,2005,6373987,Health Care,Medical Specialities
DY,Dycom Industries Inc. Common Stock,$82.29,0.93,1.143%,2432217469.00,United States,,421240,Industrials,Water Sewer Pipeline Comm & Power Line Construction
E,ENI S.p.A. Common Stock,$31.71,1.08,3.526%,53041160701.00,Italy,,503989,Energy,Oil & Gas Production
EA,Electronic Arts Inc. Common Stock,$111.80,0.01,0.009%,30658645233.00,United States,,2904802,Consumer Discretionary,Recreational Games/Products/Toys
EBAY,eBay Inc. Common Stock,$48.08,-0.31,-0.641%,26091048903.00,United States,1998,3745082,Consumer Discretionary,Catalog/Specialty Distribution
EBC,Eastern Bankshares Inc. Common Stock,$15.88,0.02,0.126%,2797612519.00,United States,2020,517458,Finance,Major Banks
EBR,Centrais Electricas Brasileiras S A American Depositary Shares (Each representing one Common Share),$7.11,0.20,2.894%,16330199631.00,,2016,2270226,Utilities,Electric Utilities: Central
EC,Ecopetrol S.A. American Depositary Shares,$10.95,0.45,4.286%,22511390337.00,Colombia,,2189575,Energy,Oil & Gas Production
ECL,Ecolab Inc. Common Stock,$146.02,0.25,0.172%,41590593321.00,United States,,1410949,Consumer Discretionary,Package Goods/Cosmetics
ED,Consolidated Edison Inc. Common Stock,$92.36,2.17,2.406%,32775132641.00,United States,,1373765,Utilities,Power Generation
EDR,Endeavor Group Holdings Inc. Class A Common Stock,$21.10,-0.50,-2.315%,6106843552.00,,2021,1088174,Consumer Discretionary,Movies/Entertainment
EDU,New Oriental Education & Technology Group Inc. Sponsored ADR representing 10 Ordinary Share (Cayman Islands),$39.80,-1.94,-4.648%,6763515644.00,China,2006,2110842,Real Estate,Other Consumer Services
EEFT,Euronet Worldwide Inc. Common Stock,$113.11,0.43,0.382%,5609563427.00,United States,1997,308255,Technology,EDP Services
EFSC,Enterprise Financial Services Corporation Common Stock,$54.67,0.07,0.128%,2036621510.00,United States,,102126,Finance,Major Banks
EFX,Equifax Inc. Common Stock,$206.16,-0.57,-0.276%,25242937323.00,United States,,682079,Finance,Advertising
EGP,EastGroup Properties Inc. Common Stock,$167.27,-0.67,-0.399%,7288880409.00,United States,,221429,Real Estate,Real Estate Investment Trusts
