Symbol,Name,Last Sale,Net Change,% Change,Market Cap,Country,IPO Year,Volume,Sector,Industry
SBUX,Starbucks Corporation Common Stock,$107.09,1.04,0.981%,123078537000.00,United States,1992,6292011,Consumer Discretionary,Beverages - Non-Alcoholic
SCCO,Southern Copper Corporation Common Stock,$73.59,-0.87,-1.168%,56892316334.00,United States,,966591,Basic Materials,Metal Mining
SCHW,Charles Schwab Corporation (The) Common Stock,$80.46,0.88,1.106%,150197849871.00,United States,,4809440,Finance,Investment Bankers/Brokers/Service
SCI,Service Corporation International Common Stock,$71.23,1.00,1.424%,10955566620.00,United States,,770199,Consumer Discretionary,Other Consumer Services
SCL,Stepan Company Common Stock,$108.89,1.00,0.927%,2420440676.00,United States,,63819,Consumer Discretionary,Package Goods/Cosmetics
SDRL,Seadrill Limited Common Shares,$43.29,1.42,3.391%,2164499913.00,,2022,231855,,
SE,Sea Limited American Depositary Shares each representing one Class A Ordinary Share,$64.00,-3.32,-4.932%,35951229440.00,United States,2017,3500613,Technology,Computer Software: Prepackaged Software
SEAS,SeaWorld Entertainment Inc. Common Stock,$65.72,0.43,0.659%,4198621963.00,United States,2013,863709,Consumer Discretionary,Movies/Entertainment
SEB,Seaboard Corporation Common Stock,$3844.32,44.31,1.166%,4462405925.00,United States,1996,525,Industrials,Consumer Electronics/Appliances
SEDG,SolarEdge Technologies Inc. Common Stock,$300.71,4.84,1.636%,16808147861.00,Israel,2015,1268954,Technology,Semiconductors
SEE,Sealed Air Corporation Common Stock,$49.30,-0.74,-1.479%,7131615835.00,United States,,1697446,Industrials,Containers/Packaging
SEIC,SEI Investments Company Common Stock,$62.43,-0.23,-0.367%,8375733660.00,United States,1981,502011,Finance,Investment Bankers/Brokers/Service
SEM,Select Medical Holdings Corporation Common Stock,$28.85,0.63,2.232%,3663477293.00,United States,2009,474084,Health Care,Hospital/Nursing Management
SF,Stifel Financial Corporation Common Stock,$66.38,-0.07,-0.105%,6993000240.00,United States,,465306,Finance,Investment Bankers/Brokers/Service
SFBS,ServisFirst Bancshares Inc. Common Stock,$72.71,0.26,0.359%,3950081778.00,United States,,197461,Finance,Major Banks
SFM,Sprouts Farmers Market Inc. Common Stock,$32.58,0.14,0.432%,3448673473.00,United States,2013,1057629,Consumer Discretionary,Specialty Foods
SFNC,Simmons First National Corporation Class A Common Stock,$22.47,-0.27,-1.187%,2854738315.00,United States,,403555,Finance,Major Banks
SGEN,Seagen Inc. Common Stock,$135.41,-0.14,-0.103%,25140884244.00,United States,2001,670181,Health Care,Biotechnology: Biological Products (No Diagnostic Substances)
SGFY,Signify Health Inc. Class A Common Stock,$28.80,0.10,0.348%,6795326304.00,,2021,2784302,Technology,Retail: Computer Software & Peripheral Equipment
SGML,Sigma Lithium Corporation Common Shares,$28.28,-0.29,-1.015%,2926980000.00,Canada,,391905,Industrials,Industrial Machinery/Components
SGRY,Surgery Partners Inc. Common Stock,$34.03,0.77,2.315%,4172203741.00,United States,2015,501107,Health Care,Managed Health Care
SHAK,Shake Shack Inc. Class A Common Stock,$55.49,-1.21,-2.134%,2179643815.00,United States,2015,938213,Consumer Discretionary,Restaurants
SHC,Sotera Health Company Common Stock,$16.75,-0.41,-2.389%,4725401108.00,United States,2020,934386,Health Care,Medical Specialities
SHEL,Royal Dutch Shell PLC American Depositary Shares (each representing two (2) Ordinary Shares) ,$61.76,1.97,3.295%,214922176250.00,Netherlands,2022,7370447,Energy,Oil & Gas Production
SHG,Shinhan Financial Group Co Ltd American Depositary Shares,$32.60,0.90,2.839%,16586179654.00,South Korea,,100347,Finance,Major Banks
SHLS,Shoals Technologies Group Inc. Class A Common Stock,$24.78,0.28,1.143%,2862297210.00,United States,2021,1991707,Technology,Semiconductors
SHO,Sunstone Hotel Investors Inc. Sunstone Hotel Investors Inc. Common Shares,$10.52,-0.20,-1.866%,2213402950.00,United States,2004,768255,Real Estate,Real Estate Investment Trusts
SHOO,Steven Madden Ltd. Common Stock,$33.58,-0.01,-0.03%,2615327292.00,United States,1993,655434,Consumer Discretionary,Shoe Manufacturing
SHOP,Shopify Inc. Class A Subordinate Voting Shares,$48.30,-1.34,-2.699%,61441912466.00,Canada,2015,14703414,,
SHW,Sherwin-Williams Company (The) Common Stock,$230.49,-1.02,-0.441%,59729965954.00,United States,,1451795,Consumer Discretionary,Paints/Coatings
SID,Companhia Siderurgica Nacional S.A. Common Stock,$3.27,0.02,0.615%,4537203634.00,Brazil,,2134644,Industrials,Steel/Iron Ore
SIG,Signet Jewelers Limited Common Shares,$76.12,-0.28,-0.366%,3458676315.00,Bermuda,,420259,Consumer Discretionary,Consumer Specialties
SIGI,Selective Insurance Group Inc. Common Stock,$99.96,-0.05,-0.05%,6027588000.00,United States,,212461,Finance,Property-Casualty Insurers
SIM,Grupo Simec S.A.B. de C.V. American Depositary Shares,$36.10,3.00,9.063%,5989100863.00,Mexico,1998,2431,Industrials,Aluminum
SIMO,Silicon Motion Technology Corporation American Depositary Shares,$65.84,-0.72,-1.082%,2175722962.00,Taiwan,2005,177837,Technology,Semiconductors
SIRI,Sirius XM Holdings Inc. Common Stock,$4.72,-0.06,-1.255%,18363162086.00,United States,,19069824,Consumer Discretionary,Movies/Entertainment
SITC,SITE Centers Corp. Common Stock,$13.83,0.26,1.916%,2916096990.00,United States,,1073750,Real Estate,Real Estate Investment Trusts
SITE,SiteOne Landscape Supply Inc. Common Stock,$146.87,-2.49,-1.667%,6624252789.00,United States,2016,265411,,
SITM,SiTime Corporation Common Stock,$124.48,-3.10,-2.43%,2668787840.00,United States,2019,134330,Technology,Semiconductors
SIVB,SVB Financial Group Common Stock,$310.03,-5.86,-1.855%,18345058886.00,United States,,604975,Finance,Major Banks
SIX,Six Flags Entertainment Corporation New Common Stock,$27.75,-0.64,-2.254%,2307592986.00,United States,,1601106,Consumer Discretionary,Movies/Entertainment
SJM,J.M. Smucker Company (The) New Common Stock,$148.93,2.85,1.951%,15881747908.00,United States,,796289,Consumer Staples,Packaged Foods
SJR,Shaw Communications Inc. Common Stock,$29.65,0.26,0.885%,14817195497.00,Canada,,1885199,,
SJW,SJW Group Common Stock (DE),$77.22,0.35,0.455%,2341257659.00,United States,1972,147719,Utilities,Water Supply
SKM,SK Telecom Co. Ltd. Common Stock,$20.62,0.31,1.526%,8100578238.00,South Korea,,267850,Telecommunications,Telecommunications Equipment
SKX,Skechers U.S.A. Inc. Common Stock,$43.78,-0.33,-0.748%,6790313418.00,United States,1999,2228185,Consumer Discretionary,Shoe Manufacturing
SKY,Skyline Champion Corporation Common Stock,$66.84,-1.15,-1.691%,3813006441.00,United States,,584860,Consumer Discretionary,Homebuilding
SLAB,Silicon Laboratories Inc. Common Stock,$184.32,1.31,0.716%,5879649853.00,United States,2000,522706,Technology,Semiconductors
SLB,Schlumberger N.V. Common Stock,$56.36,2.52,4.681%,80041823409.00,France,,9408091,Energy,Oilfield Services/Equipment
SLF,Sun Life Financial Inc. Common Stock,$50.71,0.00,0.00%,29736187205.00,Canada,,416131,Consumer Discretionary,Advertising
SLG,SL Green Realty Corp Common Stock,$38.93,0.19,0.49%,2506313400.00,United States,1997,1087054,Real Estate,Real Estate Investment Trusts
SLGN,Silgan Holdings Inc. Common Stock,$53.75,0.22,0.411%,5916746626.00,United States,2022,312703,Industrials,Containers/Packaging
SLM,SLM Corporation Common Stock,$15.25,0.08,0.527%,3670675000.00,United States,,2669297,Finance,Finance: Consumer Services
SM,SM Energy Company Common Stock,$33.33,1.71,5.408%,4092792213.00,United States,,1286860,Energy,Oil & Gas Production
SMAR,Smartsheet Inc. Class A Common Stock,$41.82,-2.12,-4.825%,5492218802.00,United States,2018,1984088,Technology,EDP Services
SMCI,Super Micro Computer Inc. Common Stock,$90.02,3.02,3.471%,4828416963.00,United States,2020,1397748,Technology,Computer Manufacturing
SMFG,Sumitomo Mitsui Financial Group Inc Unsponsored American Depositary Shares (Japan),$8.77,0.10,1.153%,59435912187.00,Japan,,2651427,Finance,Commercial Banks
SMG,Scotts Miracle-Gro Company (The) Common Stock,$76.70,-1.86,-2.368%,4291810474.00,United States,1992,850518,Industrials,Agricultural Chemicals
SMPL,The Simply Good Foods Company Common Stock,$37.00,-0.02,-0.054%,3681180209.00,United States,,419542,Consumer Staples,Packaged Foods
SMTC,Semtech Corporation Common Stock,$32.31,-0.56,-1.704%,2062597024.00,United States,,611628,Technology,Semiconductors
SNA,Snap-On Incorporated Common Stock,$251.33,2.07,0.83%,13359355420.00,United States,,213265,Consumer Discretionary,Diversified Manufacture
SNAP,Snap Inc. Class A Common Stock,$10.65,-0.33,-3.005%,16841219358.00,United States,2017,25586765,Technology,Internet and Information Services
SNDR,Schneider National Inc. Common Stock,$28.79,-0.37,-1.269%,5124973541.00,United States,2017,612618,Industrials,Trucking Freight/Courier Services
SNEX,StoneX Group Inc. Common Stock,$103.96,4.82,4.862%,2146637293.00,United States,,237839,Finance,Investment Bankers/Brokers/Service
SNN,Smith & Nephew SNATS Inc. Common Stock,$27.92,0.04,0.143%,12192012096.00,United Kingdom,,728405,Health Care,Industrial Specialties
SNOW,Snowflake Inc. Class A Common Stock,$157.33,-5.35,-3.289%,50597328000.00,United States,2020,4153127,Technology,Computer Software: Prepackaged Software
SNPS,Synopsys Inc. Common Stock,$359.11,-4.60,-1.265%,54734538537.00,United States,1992,590398,Technology,EDP Services
SNV,Synovus Financial Corp. Common Stock,$43.29,0.07,0.162%,6298116386.00,United States,,1024711,Finance,Major Banks
SNX,TD SYNNEX Corporation Common Stock,$101.88,0.07,0.069%,9622048348.00,United States,2003,239688,Consumer Discretionary,Electronics Distribution
SNY,Sanofi ADS,$47.54,-0.54,-1.123%,119101055507.00,France,,2558951,Health Care,Biotechnology: Pharmaceutical Preparations
SO,Southern Company (The) Common Stock,$66.88,1.10,1.672%,72810438737.00,United States,,2592410,Utilities,Power Generation
SOFI,SoFi Technologies Inc. Common Stock  ,$6.81,-0.08,-1.161%,5523888754.00,United States,,37261465,Finance,Diversified Financial Services
SON,Sonoco Products Company Common Stock,$59.53,-0.65,-1.08%,5804902814.00,United States,,567222,Industrials,Containers/Packaging
SONO,Sonos Inc. Common Stock,$20.09,-0.71,-3.413%,2558361613.00,United States,2018,4130817,Consumer Discretionary,Consumer Electronics/Video Chains
SONY,Sony Group Corporation American Depositary Shares ,$90.12,0.00,0.00%,111270297136.00,Japan,,508959,Consumer Staples,Consumer Electronics/Appliances
SPB,Spectrum Brands Holdings Inc. Common Stock,$64.07,-0.10,-0.156%,2626908890.00,United States,,868175,,
SPG,Simon Property Group Inc. Common Stock,$124.35,-0.06,-0.048%,40656703911.00,United States,,1171469,Real Estate,Real Estate Investment Trusts
SPGI,S&P Global Inc. Common Stock,$363.86,0.21,0.058%,118545588000.00,United States,,1324715,Finance,Advertising
SPLK,Splunk Inc. Common Stock,$104.68,-2.94,-2.732%,17136116000.00,United States,2012,1353383,Technology,Computer Software: Prepackaged Software
SPOT,Spotify Technology S.A. Ordinary Shares,$125.16,4.33,3.584%,24192585548.00,Luxembourg,2018,3799887,Consumer Discretionary,Broadcasting
SPR,Spirit Aerosystems Holdings Inc. Common Stock,$34.58,-0.18,-0.518%,3639628718.00,United States,2006,2718889,Industrials,Military/Government/Technical
SPSC,SPS Commerce Inc. Common Stock,$145.58,8.06,5.861%,5246952724.00,United States,2010,203881,Technology,EDP Services
SPT,Sprout Social Inc Class A Common Stock,$60.93,-0.52,-0.846%,3341298289.00,United States,2019,616733,Technology,EDP Services
SPWR,SunPower Corporation Common Stock,$15.33,-0.22,-1.415%,2670217878.00,United States,2005,3069771,Technology,Semiconductors
SPXC,SPX Technologies Inc. Common Stock,$73.28,0.41,0.563%,3311304972.00,United States,,84058,Industrials,Industrial Machinery/Components
SQ,Block Inc. Class A Common Stock,$75.23,-0.95,-1.247%,44992888703.00,United States,2015,11267760,Technology,Computer Software: Prepackaged Software
SQM,Sociedad Quimica y Minera S.A. Common Stock,$93.04,1.16,1.263%,26575741656.00,Chile,1993,873301,Industrials,Agricultural Chemicals
SQSP,Squarespace Inc. Class A Common Stock,$22.89,0.20,0.881%,3132030574.00,,2021,433110,Technology,EDP Services
SR,Spire Inc. Common Stock,$72.77,1.09,1.521%,3823782826.00,United States,,239501,Utilities,Oil/Gas Transmission
SRAD,Sportradar Group AG Class A Ordinary Shares,$12.60,-0.25,-1.946%,3725060182.00,Switzerland,2021,179930,Technology,Computer Software: Programming Data Processing
SRC,Spirit Realty Capital Inc. Common Stock,$44.03,0.56,1.288%,6149240411.00,United States,2013,1241459,Real Estate,Real Estate Investment Trusts
SRCL,Stericycle Inc. Common Stock,$54.55,0.41,0.757%,5028649146.00,United States,1996,223906,Utilities,Environmental Services
SRE,DBA Sempra Common Stock,$157.13,4.37,2.861%,49391201328.00,United States,,1093203,Utilities,Oil/Gas Transmission
SRPT,Sarepta Therapeutics Inc. Common Stock (DE),$120.45,-0.68,-0.561%,10573411279.00,United States,,624331,Health Care,Biotechnology: Pharmaceutical Preparations
SSB,SouthState Corporation Common Stock,$79.20,0.17,0.215%,5995801390.00,United States,,225637,Finance,Major Banks
SSD,Simpson Manufacturing Company Inc. Common Stock,$109.74,-0.49,-0.445%,4674691680.00,United States,,139577,,
SSL,Sasol Ltd. American Depositary Shares,$16.75,0.31,1.886%,10731182501.00,South Africa,,157104,Energy,Oil & Gas Production
SSNC,SS&C Technologies Holdings Inc. Common Stock,$62.26,-0.67,-1.065%,15683967404.00,United States,2010,1504059,Technology,EDP Services
SSRM,SSR Mining Inc. Common Stock,$14.58,-1.19,-7.546%,3012344086.00,Canada,,4687526,,
SSTK,Shutterstock Inc. Common Stock,$79.67,4.09,5.411%,2853385034.00,United States,2012,624769,Technology,Interactive Media
ST,Sensata Technologies Holding plc Ordinary Shares,$51.52,-0.16,-0.31%,7880579159.00,Netherlands,2010,1337650,Industrials,Industrial Machinery/Components
STAA,STAAR Surgical Company Common Stock,$68.56,-2.17,-3.068%,3305023859.00,United States,,545001,Health Care,Ophthalmic Goods
STAG,Stag Industrial Inc. Common Stock,$34.90,-0.20,-0.57%,6254653616.00,United States,2011,1009821,Real Estate,Real Estate Investment Trusts
STE,STERIS plc (Ireland) Ordinary Shares,$192.87,0.53,0.276%,19252852945.00,United States,,1018208,Health Care,Industrial Specialties
STLA,Stellantis N.V. Common Shares,$16.40,-0.35,-2.09%,52699304556.00,United Kingdom,2014,5102925,Consumer Discretionary,Auto Manufacturing
STLD,Steel Dynamics Inc.,$122.32,0.97,0.799%,21475894749.00,United States,1996,1206568,Industrials,Steel/Iron Ore
STM,STMicroelectronics N.V. Common Stock,$48.07,-1.05,-2.138%,43408942058.00,Switzerland,,3069616,Technology,Semiconductors
STN,Stantec Inc Common Stock,$53.06,0.60,1.144%,5877253882.00,Canada,,45735,Consumer Discretionary,Marine Transportation
STNE,StoneCo Ltd. Class A Common Shares,$9.62,-0.27,-2.73%,3007334636.00,Brazil,2018,3787032,Technology,EDP Services
STNG,Scorpio Tankers Inc. Common Shares,$57.59,0.27,0.471%,3439735405.00,Monaco,2010,1299046,Consumer Discretionary,Marine Transportation
STR,Sitio Royalties Corp. Class A Common Stock,$26.80,1.23,4.81%,2066262660.00,United States,2022,440774,Energy,Oil & Gas Production
STRA,Strategic Education Inc. Common Stock,$93.00,-0.19,-0.204%,2274190194.00,United States,1996,102423,Consumer Discretionary,Service to the Health Industry
STT,State Street Corporation Common Stock,$92.58,0.05,0.054%,32312657381.00,United States,,2552150,Finance,Investment Managers
STVN,Stevanato Group S.p.A. Ordinary Shares,$20.03,0.38,1.934%,5301930604.00,,2021,254568,Consumer Discretionary,Containers/Packaging
STWD,STARWOOD PROPERTY TRUST INC. Starwood Property Trust Inc.,$20.21,0.26,1.303%,6256698663.00,United States,2009,2050646,Real Estate,Real Estate Investment Trusts
STX,Seagate Technology Holdings PLC Ordinary Shares (Ireland),$71.28,1.48,2.12%,14718169826.00,Ireland,2002,3299545,Technology,Electronic Components
STZ,Constellation Brands Inc. Common Stock,$228.30,1.42,0.626%,42120943398.00,United States,,747588,Consumer Staples,Beverages (Production/Distribution)
SU,Suncor Energy  Inc. Common Stock,$34.27,1.27,3.848%,46230684386.00,Canada,,4783386,,
SUI,Sun Communities Inc. Common Stock,$158.09,0.06,0.038%,19585806461.00,United States,1993,239350,Real Estate,Real Estate Investment Trusts
SUM,Summit Materials Inc. Class A Common Stock,$32.04,-0.03,-0.094%,3793673868.00,United States,2015,440214,Industrials,Building Materials
SUN,Sunoco LP Common Units representing limited partner interests,$46.81,0.63,1.364%,3920960073.00,United States,2012,191673,Energy,Oil Refining/Marketing
SUPN,Supernus Pharmaceuticals Inc. Common Stock,$38.67,-0.33,-0.846%,2090428196.00,United States,2012,322007,Health Care,Biotechnology: Pharmaceutical Preparations
SUZ,Suzano S.A. American Depositary Shares (each representing One Ordinary Share),$8.89,0.11,1.253%,11640139413.00,,2018,1167515,Basic Materials,Paper
SWAV,ShockWave Medical Inc. Common Stock,$180.45,0.33,0.183%,6521876591.00,United States,2019,350110,Health Care,Medical/Dental Instruments
SWK,Stanley Black & Decker Inc. Common Stock,$85.83,1.08,1.274%,12697843492.00,United States,,1459063,Consumer Discretionary,Diversified Manufacture
SWKS,Skyworks Solutions Inc. Common Stock,$119.61,-1.26,-1.042%,19014900713.00,United States,,2114347,Technology,Semiconductors
SWN,Southwestern Energy Company Common Stock,$5.42,0.16,3.042%,5981396386.00,United States,,21724437,Energy,Oil & Gas Production
SWX,Southwest Gas Holdings Inc. Common Stock (DE),$66.18,1.24,1.909%,4438548460.00,United States,,271005,Utilities,Oil & Gas Production
SXT,Sensient Technologies Corporation Common Stock,$74.10,1.61,2.221%,3114992459.00,United States,,361009,Industrials,Major Chemicals
SYF,Synchrony Financial Common Stock,$36.42,0.18,0.497%,15959244000.00,United States,2014,3689412,Finance,Diversified Financial Services
SYK,Stryker Corporation Common Stock,$264.34,-0.02,-0.008%,100034167432.00,United States,,1061067,Health Care,Medical/Dental Instruments
SYNA,Synaptics Incorporated Common Stock $0.001 Par Value,$123.65,-0.85,-0.683%,4871285724.00,United States,2002,389189,Technology,Computer peripheral equipment
SYNH,Syneos Health Inc. Class A Common Stock,$36.16,-0.49,-1.337%,3721009508.00,United States,2014,1209743,Health Care,Biotechnology: Commercial Physical & Biological Resarch
SYY,Sysco Corporation Common Stock,$77.58,1.12,1.465%,39379919794.00,United States,,1787195,Consumer Discretionary,Food Distributors
T,AT&T Inc.,$19.07,0.10,0.527%,135930960000.00,United States,,24923770,Consumer Discretionary,Telecommunications Equipment
TAC,TransAlta Corporation Ordinary Shares,$9.14,0.03,0.329%,2462316000.00,Canada,,276421,Utilities,Electric Utilities: Central
TAK,Takeda Pharmaceutical Company Limited American Depositary Shares (each representing 1/2 of a share of Common Stock),$16.05,0.07,0.438%,50093411843.00,,2018,2110821,Health Care,Biotechnology: Pharmaceutical Preparations
TAL,TAL Education Group American Depositary Shares,$6.41,-0.18,-2.731%,4159204753.00,China,,5260323,Consumer Discretionary,Other Consumer Services
TAP,Molson Coors Beverage Company Class B Common Stock,$51.44,0.22,0.43%,11137209328.00,Canada,,901174,Consumer Staples,Beverages (Production/Distribution)
TCBI,Texas Capital Bancshares Inc. Common Stock,$66.66,-0.33,-0.493%,3251925642.00,United States,2003,290528,Finance,Major Banks
TCN,Tricon Residential Inc. Common Shares,$8.80,-0.05,-0.565%,2409095216.00,,2021,580299,,
TCOM,Trip.com Group Limited American Depositary Shares,$36.57,-1.12,-2.972%,23468957567.00,China,2003,3412792,Consumer Discretionary,Business Services
TD,Toronto Dominion Bank (The) Common Stock,$69.69,0.87,1.264%,126882407905.00,Canada,,955617,,
TDC,Teradata Corporation Common Stock,$34.27,-0.80,-2.281%,3488686000.00,United States,,1072997,Technology,EDP Services
TDG,Transdigm Group Incorporated Common Stock,$730.47,-16.51,-2.21%,39882247810.00,United States,2006,719136,Industrials,Military/Government/Technical
TDOC,Teladoc Health Inc. Common Stock,$29.30,-1.27,-4.154%,4744463649.00,United States,2015,3205345,Health Care,Medical/Nursing Services
TDW,Tidewater Inc. Common Stock,$45.28,0.81,1.821%,2286348216.00,United States,2017,647254,Energy,Oilfield Services/Equipment
TDY,Teledyne Technologies Incorporated Common Stock,$438.36,2.37,0.544%,20546412327.00,United States,,144226,Industrials,Industrial Machinery/Components
TEAM,Atlassian Corporation Class A Common Stock,$172.23,1.08,0.631%,44140372357.00,Australia,2015,2536834,Technology,EDP Services
TECH,Bio-Techne Corp Common Stock,$76.29,0.51,0.673%,11998525008.00,United States,,1138108,Health Care,Biotechnology: Biological Products (No Diagnostic Substances)
TECK,Teck Resources Ltd Ordinary Shares,$41.13,-0.87,-2.071%,21070193045.00,Canada,,2743736,,
TEF,Telefonica SA Common Stock,$3.81,0.06,1.60%,22003655081.00,Spain,1988,799607,Telecommunications,Telecommunications Equipment
TEL,TE Connectivity Ltd. New Switzerland Registered Shares,$129.79,-2.03,-1.54%,41072904191.00,Switzerland,,1864204,Technology,Industrial Machinery/Components
TENB,Tenable Holdings Inc. Common Stock,$44.70,-0.12,-0.268%,5053603200.00,United States,2018,1366941,Technology,EDP Services
TEO,Telecom Argentina SA,$5.82,0.03,0.518%,2506892844.00,Argentina,,52346,Telecommunications,Telecommunications Equipment
TER,Teradyne Inc. Common Stock,$105.56,-2.10,-1.951%,16441618772.00,United States,,1414758,Industrials,Electrical Products
TEVA,Teva Pharmaceutical Industries Limited American Depositary Shares,$10.26,0.44,4.481%,11395215740.00,Israel,,9716007,Health Care,Biotechnology: Pharmaceutical Preparations
TEX,Terex Corporation Common Stock,$54.32,2.85,5.537%,3666600000.00,United States,,1698004,Industrials,Construction/Ag Equipment/Trucks
TFC,Truist Financial Corporation Common Stock,$48.38,0.45,0.939%,64191987020.00,United States,,5355976,Finance,Major Banks
TFII,TFI International Inc. Common Shares,$124.90,0.09,0.072%,10888752399.00,,,325443,,
TFPM,Triple Flag Precious Metals Corp. Common Shares,$14.04,0.12,0.862%,2818993081.00,,2022,184252,,
TFSL,TFS Financial Corporation Common Stock,$14.33,0.13,0.915%,4016236729.00,United States,2007,160997,Finance,Savings Institutions
TFX,Teleflex Incorporated Common Stock,$245.48,-2.99,-1.203%,11514591664.00,United States,,286815,Health Care,Medical/Dental Instruments
TGNA,TEGNA Inc,$19.93,-0.09,-0.45%,4450236007.00,United States,,856499,Industrials,Broadcasting
TGT,Target Corporation Common Stock,$170.02,-1.35,-0.788%,78261921162.00,United States,,1840831,Consumer Discretionary,Department/Specialty Retail Stores
TGTX,TG Therapeutics Inc. Common Stock,$17.90,0.38,2.169%,2601621209.00,United States,,3956077,Health Care,Biotechnology: Pharmaceutical Preparations
THC,Tenet Healthcare Corporation Common Stock,$58.65,2.15,3.805%,6341424859.00,United States,,2458878,Health Care,Hospital/Nursing Management
THG,Hanover Insurance Group Inc,$142.82,1.37,0.969%,5084392000.00,United States,,196855,Finance,Property-Casualty Insurers
THO,Thor Industries Inc. Common Stock,$92.29,-0.87,-0.934%,4939244053.00,United States,,489397,Industrials,Homebuilding
THRM,Gentherm Inc Common Stock,$71.23,-1.43,-1.968%,2364698312.00,United States,,79024,Consumer Discretionary,Auto Parts:O.E.M.
THS,Treehouse Foods Inc. Common Stock,$48.33,0.69,1.448%,2710464422.00,United States,,346893,Consumer Staples,Packaged Foods
TIGO,Millicom International Cellular S.A. Common Stock,$18.64,0.03,0.161%,3185389600.00,Luxembourg,,232343,Telecommunications,Telecommunications Equipment
TIMB,TIM S.A. American Depositary Shares (Each representing 5 Common Shares) ,$10.74,0.49,4.78%,5199861538.00,,2020,564589,Telecommunications,Telecommunications Equipment
TIXT,TELUS International (Cda) Inc. Subordinate Voting Shares,$21.80,0.07,0.322%,5798800000.00,,2021,765068,,
TJX,TJX Companies Inc. (The) Common Stock,$80.25,-0.51,-0.632%,92729207957.00,United States,,3546837,Consumer Discretionary,Department/Specialty Retail Stores
TKC,Turkcell Iletisim Hizmetleri AS Common Stock,$4.43,0.07,1.606%,3868464173.00,Turkey,,252386,Telecommunications,Telecommunications Equipment
TKR,Timken Company (The) Common Stock,$84.01,0.80,0.961%,6111189164.00,United States,,509769,Industrials,Metal Fabrications
TLK,PT Telekomunikasi Indonesia Tbk,$25.17,0.39,1.574%,24933959893.00,Indonesia,,164920,Telecommunications,Telecommunications Equipment
TM,Toyota Motor Corporation Common Stock,$143.42,-1.41,-0.974%,195687158557.00,Japan,,230055,Consumer Discretionary,Auto Manufacturing
TMDX,TransMedics Group Inc. Common Stock,$63.68,-0.67,-1.041%,2032934330.00,United States,2019,435734,Health Care,Biotechnology: Electromedical & Electrotherapeutic Apparatus
TME,Tencent Music Entertainment Group American Depositary Shares each representing two Class A Ordinary Shares,$8.10,-0.45,-5.263%,13730124761.00,,2018,5918540,Consumer Discretionary,Broadcasting
TMHC,Taylor Morrison Home Corporation Common Stock,$35.85,0.23,0.646%,3884226219.00,United States,2013,602737,Consumer Discretionary,Homebuilding
TMO,Thermo Fisher Scientific Inc Common Stock,$571.41,2.48,0.436%,224104463225.00,United States,,763738,Industrials,Biotechnology: Laboratory Analytical Instruments
TMUS,T-Mobile US Inc. Common Stock,$143.70,0.85,0.595%,177320063209.00,United States,,3558023,Telecommunications,Telecommunications Equipment
TNDM,Tandem Diabetes Care Inc. Common Stock,$40.95,-0.27,-0.655%,2633035246.00,United States,2013,1220943,Health Care,Medical/Dental Instruments
TNET,TriNet Group Inc. Common Stock,$77.81,0.64,0.829%,4724224424.00,,2014,245927,Consumer Discretionary,Diversified Commercial Services
TNL,Travel   Leisure Co. Common  Stock,$41.46,-0.97,-2.286%,3369894713.00,United States,,533307,Consumer Discretionary,Other Consumer Services
TOL,Toll Brothers Inc. Common Stock,$58.76,0.45,0.772%,6497137094.00,United States,,1015718,Consumer Discretionary,Homebuilding
TOST,Toast Inc. Class A Common Stock,$22.80,-0.03,-0.131%,11872827768.00,,2021,4014072,Technology,EDP Services
